{
  "metadata": {
    "schema_version": "1.0",
    "source_type": "screenshot",
    "source_name": "fan-in-collector-example.png",
    "directed": true,
    "extraction_method": "manual_phase_1_sample",
    "extraction_confidence": 0.92,
    "domain": "aml"
  },
  "nodes": [
    {
      "id": "acct_a",
      "label": "Account A",
      "type": "account",
      "confidence": 0.96,
      "position": { "x": 120, "y": 80, "confidence": 0.9 }
    },
    {
      "id": "acct_b",
      "label": "Account B",
      "type": "account",
      "confidence": 0.95,
      "position": { "x": 120, "y": 180, "confidence": 0.91 }
    },
    {
      "id": "acct_c",
      "label": "Account C",
      "type": "account",
      "confidence": 0.94,
      "position": { "x": 120, "y": 280, "confidence": 0.88 }
    },
    {
      "id": "acct_d",
      "label": "Account D",
      "type": "account",
      "confidence": 0.9,
      "position": { "x": 120, "y": 380, "confidence": 0.86 }
    },
    {
      "id": "acct_collector",
      "label": "Central Account",
      "type": "account",
      "confidence": 0.97,
      "position": { "x": 420, "y": 230, "confidence": 0.93 },
      "attributes": {
        "role_hint": "collector"
      }
    }
  ],
  "edges": [
    {
      "id": "transfer_a_collector",
      "source": "acct_a",
      "target": "acct_collector",
      "label": "$500",
      "amount": 500,
      "currency": "USD",
      "confidence": 0.92
    },
    {
      "id": "transfer_b_collector",
      "source": "acct_b",
      "target": "acct_collector",
      "label": "$500",
      "amount": 500,
      "currency": "USD",
      "confidence": 0.91
    },
    {
      "id": "transfer_c_collector",
      "source": "acct_c",
      "target": "acct_collector",
      "label": "$500",
      "amount": 500,
      "currency": "USD",
      "confidence": 0.9
    },
    {
      "id": "transfer_d_collector",
      "source": "acct_d",
      "target": "acct_collector",
      "label": "$475",
      "amount": 475,
      "currency": "USD",
      "confidence": 0.87
    }
  ],
  "warnings": [
    "Sample graph is hand-authored for Phase 1 analytics and validation tests."
  ]
}
